{
  "schemaVersion": 1,
  "stages": {
    "keywords": {
      "status": "done",
      "durationMs": 100
    },
    "cooccurrence": {
      "status": "done",
      "durationMs": 101
    },
    "topics": {
      "status": "done",
      "durationMs": 102
    },
    "clusters": {
      "status": "done",
      "durationMs": 103
    },
    "duplicates": {
      "status": "done",
      "durationMs": 104
    },
    "sentiment": {
      "status": "done",
      "durationMs": 105
    },
    "quality": {
      "status": "done",
      "durationMs": 106
    },
    "association": {
      "status": "done",
      "durationMs": 107
    },
    "hotcold": {
      "status": "done",
      "durationMs": 108
    },
    "insights": {
      "status": "skipped",
      "reason": "NO_API_KEY"
    }
  },
  "preprocess": {
    "unrecognizedRatio": 0.04
  },
  "keywords": {
    "byActivity": [
      {
        "activityKey": "act-04",
        "terms": [
          {
            "term": "tarjeta",
            "weight": 0.42
          },
          {
            "term": "pasarela",
            "weight": 0.31
          }
        ]
      }
    ],
    "wordCloud": [
      {
        "term": "pago",
        "weight": 34
      },
      {
        "term": "pedido",
        "weight": 21
      }
    ]
  },
  "cooccurrence": {
    "nodes": [
      {
        "id": "pago",
        "freq": 34,
        "community": 0
      },
      {
        "id": "tarjeta",
        "freq": 12,
        "community": 0
      }
    ],
    "edges": [
      {
        "source": "pago",
        "target": "tarjeta",
        "pmi": 1.3,
        "count": 9
      }
    ]
  },
  "topics": [
    {
      "id": "t0",
      "label": "pago · tarjeta · pasarela",
      "terms": [
        {
          "term": "pago",
          "weight": 0.5
        }
      ],
      "detailIds": [
        "66f200000000000000000001"
      ],
      "activityKeys": [
        "act-04"
      ]
    }
  ],
  "clusters": {
    "groups": [
      {
        "id": "g0",
        "detailIds": [
          "66f200000000000000000001",
          "66f200000000000000000002"
        ],
        "representativeId": "66f200000000000000000001"
      }
    ],
    "points": [
      {
        "detailId": "66f200000000000000000001",
        "x": 0.1,
        "y": -0.4,
        "groupId": "g0"
      },
      {
        "detailId": "66f200000000000000000002",
        "x": 0.12,
        "y": -0.38,
        "groupId": "g0"
      },
      {
        "detailId": "66f200000000000000000003",
        "x": 1.4,
        "y": 0.9,
        "groupId": null
      }
    ]
  },
  "duplicates": [
    {
      "pair": [
        "66f200000000000000000001",
        "66f200000000000000000002"
      ],
      "similarity": 0.93
    }
  ],
  "sentiment": {
    "byActivity": [
      {
        "activityKey": "act-04",
        "pos": 1,
        "neu": 10,
        "neg": 2
      }
    ],
    "mostNegative": [
      {
        "detailId": "66f200000000000000000002",
        "score": 0.81
      }
    ]
  },
  "quality": [
    {
      "detailId": "66f200000000000000000002",
      "score": 70,
      "issues": [
        {
          "code": "ambiguous_term",
          "field": "then",
          "term": "rápido",
          "penalty": 15,
          "suggestion": "Hazlo medible: indica un tiempo o una cifra."
        },
        {
          "code": "too_short",
          "field": "when",
          "penalty": 10
        }
      ]
    }
  ],
  "association": [
    {
      "antecedent": [
        "tag:pagos"
      ],
      "consequent": [
        "type:non_functional"
      ],
      "support": 0.22,
      "confidence": 0.9,
      "lift": 2.4,
      "sentence": "Cuando la etiqueta es pagos, el 90 % de los requisitos son no funcionales."
    }
  ],
  "hotcold": [
    {
      "activityKey": "act-04",
      "class": "hot",
      "score": 2.1,
      "reason": "volumen"
    },
    {
      "activityKey": "act-10",
      "class": "cold",
      "score": -1.4,
      "reason": "sin detalles"
    }
  ],
  "insightsFewerThanExpected": false,
  "insights": [
    {
      "id": "i1",
      "title": "Validar pago concentra los no funcionales",
      "statement": "La actividad Validar pago reúne el 30 % de los requisitos no funcionales.",
      "recommendation": "Revisa con el equipo los tiempos de respuesta de la pasarela.",
      "evidence": [
        {
          "kind": "activity",
          "id": "act-04"
        },
        {
          "kind": "rule",
          "id": "0"
        }
      ]
    }
  ]
}
